{
  "schema_version": "study-baseline-result/v1",
  "executed_under": {
    "identity_digest": "b032da4a3971979792bc024bf9cd1a41a2d83d340bad5b59ef3e1a9aeaa77236",
    "store_id": "stellarator-baseline-point-v1.db",
    "case_id": "stellarator-baseline-point-v1:c0000"
  },
  "point": {
    "stellarator_09__stellaris__availability_direct": 0.0,
    "stellarator_09__stellaris__plasma__R": 12.7,
    "stellarator_09__stellaris__plasma__a": 1.3
  },
  "channels": {
    "stellarator_09__stellaris__blanket__blanket_cost__cost": 719155016.1966425,
    "stellarator_09__stellaris__blanket__breeding__defined_flag": 1.0,
    "stellarator_09__stellaris__blanket__breeding__interpolation_allowance": 0.01,
    "stellarator_09__stellaris__blanket__breeding__tbr_li6": 1.1947266274106922,
    "stellarator_09__stellaris__blanket__breeding__tbr_li7": 0.0033472921433443455,
    "stellarator_09__stellaris__blanket__breeding__tbr_lower": 1.1861455810023918,
    "stellarator_09__stellaris__blanket__breeding__tbr_mean": 1.1980739195540366,
    "stellarator_09__stellaris__blanket__breeding__tbr_std_error": 0.0009641692758224518,
    "stellarator_09__stellaris__blanket__first_wall__wall_load_calc__wall_load": 3.0224258631282654,
    "stellarator_09__stellaris__blanket__first_wall__wall_peak_cal__calibration": 1.3164408570995383,
    "stellarator_09__stellaris__blanket__first_wall__wall_peak_calc__wall_load_peak": 3.9788448937763854,
    "stellarator_09__stellaris__blanket__source_heat__q_source": 3125.9322770825056,
    "stellarator_09__stellaris__bop_capital__bop_capital": 580934471.49956,
    "stellarator_09__stellaris__breeding_adequacy__balance_rate": 6.03097635457502e+18,
    "stellarator_09__stellaris__breeding_adequacy__decay_rate": 1.5726523913486374e+18,
    "stellarator_09__stellaris__breeding_adequacy__defined_flag": 1.0,
    "stellarator_09__stellaris__breeding_adequacy__design_margin": 0.1480739195540366,
    "stellarator_09__stellaris__breeding_adequacy__extracted_supply_rate": 1.1282883404390923e+21,
    "stellarator_09__stellaris__breeding_adequacy__extraction_loss_rate": 0.0,
    "stellarator_09__stellaris__breeding_adequacy__fuel_margin": 0.006403997294744279,
    "stellarator_09__stellaris__breeding_adequacy__numerical_margin": -0.0055243412569006,
    "stellarator_09__stellaris__breeding_adequacy__production_rate": 1.1282883404390923e+21,
    "stellarator_09__stellaris__breeding_adequacy__recycle_loss_rate": 1.7893285312748084e+20,
    "stellarator_09__stellaris__breeding_adequacy__required_tbr": 1.1916699222592924,
    "stellarator_09__stellaris__breeding_adequacy__stock_growth_rate": 0.0,
    "stellarator_09__stellaris__buildings__administration__civil__cost_2018": 5634342.209388552,
    "stellarator_09__stellaris__buildings__administration__civil__cost_2025": 7222997.83832009,
    "stellarator_09__stellaris__buildings__administration__civil__sub_cost_2018": 927945.0488220555,
    "stellarator_09__stellaris__buildings__administration__civil__super_cost_2018": 4706397.160566497,
    "stellarator_09__stellaris__buildings__buildings_cost__cost": 652635305.4726406,
    "stellarator_09__stellaris__buildings__civil_rollup__civil_capital": 614376866.3119471,
    "stellarator_09__stellaris__buildings__control__civil__cost_2018": 1508080.330707875,
    "stellarator_09__stellaris__buildings__control__civil__cost_2025": 1933297.7238345875,
    "stellarator_09__stellaris__buildings__control__civil__sub_cost_2018": 191499.62771783525,
    "stellarator_09__stellaris__buildings__control__civil__super_cost_2018": 1316580.7029900397,
    "stellarator_09__stellaris__buildings__cooling_annex__civil__cost_2018": 52188789.04319997,
    "stellarator_09__stellaris__buildings__cooling_annex__civil__cost_2025": 66903907.578678094,
    "stellarator_09__stellaris__buildings__cooling_annex__civil__sub_cost_2018": 5728125.093023846,
    "stellarator_09__stellaris__buildings__cooling_annex__civil__super_cost_2018": 46460663.95017613,
    "stellarator_09__stellaris__buildings__cooling_hall__civil__cost_2018": 19495782.261604287,
    "stellarator_09__stellaris__buildings__cooling_hall__civil__cost_2025": 24992800.916011225,
    "stellarator_09__stellaris__buildings__cooling_hall__civil__sub_cost_2018": 3023359.0806272486,
    "stellarator_09__stellaris__buildings__cooling_hall__civil__super_cost_2018": 16472423.180977037,
    "stellarator_09__stellaris__buildings__cooling_initial_handoff_days__cooling_initial_handoff_days": -30.0,
    "stellarator_09__stellaris__buildings__cooling_link__civil__cost_2018": 558811.6888865512,
    "stellarator_09__stellaris__buildings__cooling_link__civil__cost_2025": 716373.8855140613,
    "stellarator_09__stellaris__buildings__cooling_link__civil__sub_cost_2018": 59994.57236010789,
    "stellarator_09__stellaris__buildings__cooling_link__civil__super_cost_2018": 498817.11652644334,
    "stellarator_09__stellaris__buildings__cryo_coldbox__civil__cost_2018": 2391106.997075613,
    "stellarator_09__stellaris__buildings__cryo_coldbox__civil__cost_2025": 3065302.04045655,
    "stellarator_09__stellaris__buildings__cryo_coldbox__civil__sub_cost_2018": 129607.67642170517,
    "stellarator_09__stellaris__buildings__cryo_coldbox__civil__super_cost_2018": 2261499.320653908,
    "stellarator_09__stellaris__buildings__cryo_compressors__civil__cost_2018": 2699529.4021168174,
    "stellarator_09__stellaris__buildings__cryo_compressors__civil__cost_2025": 3460687.0352106867,
    "stellarator_09__stellaris__buildings__cryo_compressors__civil__sub_cost_2018": 179459.19565078284,
    "stellarator_09__stellaris__buildings__cryo_compressors__civil__super_cost_2018": 2520070.2064660345,
    "stellarator_09__stellaris__buildings__electrical_building__civil__cost_2018": 1371989.643980557,
    "stellarator_09__stellaris__buildings__electrical_building__civil__cost_2025": 1758834.9916262098,
    "stellarator_09__stellaris__buildings__electrical_building__civil__sub_cost_2018": 85326.36913528755,
    "stellarator_09__stellaris__buildings__electrical_building__civil__super_cost_2018": 1286663.2748452695,
    "stellarator_09__stellaris__buildings__facility_accounts__cost": 799758795.94032,
    "stellarator_09__stellaris__buildings__facility_accounts__installed_facility_capital": 714758795.94032,
    "stellarator_09__stellaris__buildings__facility_accounts__layout_buildings_capital": 799758795.94032,
    "stellarator_09__stellaris__buildings__facility_land__cost": 901536.9087592476,
    "stellarator_09__stellaris__buildings__fuel_building__civil__cost_2018": 9383304.495650994,
    "stellarator_09__stellaris__buildings__fuel_building__civil__cost_2025": 12029015.201712683,
    "stellarator_09__stellaris__buildings__fuel_building__civil__sub_cost_2018": 1319222.5896733885,
    "stellarator_09__stellaris__buildings__fuel_building__civil__super_cost_2018": 8064081.905977606,
    "stellarator_09__stellaris__buildings__initial_sector_start_days__initial_sector_start_days": -120.0,
    "stellarator_09__stellaris__buildings__layout__active": 1.0,
    "stellarator_09__stellaris__buildings__layout__administration_air_volume": 12479.999999999998,
    "stellarator_09__stellaris__buildings__layout__administration_clear_area": 3119.9999999999995,
    "stellarator_09__stellaris__buildings__layout__administration_clear_height": 4.0,
    "stellarator_09__stellaris__buildings__layout__administration_clear_length": 78.99367063252599,
    "stellarator_09__stellaris__buildings__layout__administration_clear_width": 39.496835316262995,
    "stellarator_09__stellaris__buildings__layout__administration_gross_area": 3191.4543035692727,
    "stellarator_09__stellaris__buildings__layout__administration_sub_concrete": 957.4362910707817,
    "stellarator_09__stellaris__buildings__layout__administration_sub_formwork": 71.81430356927339,
    "stellarator_09__stellaris__buildings__layout__administration_sub_rebar": 95743.62910707817,
    "stellarator_09__stellaris__buildings__layout__administration_super_concrete": 924.1080749909468,
    "stellarator_09__stellaris__buildings__layout__administration_super_formwork": 5073.324297560139,
    "stellarator_09__stellaris__buildings__layout__administration_super_rebar": 92410.80749909468,
    "stellarator_09__stellaris__buildings__layout__blanket_packages_per_sector": 32.0,
    "stellarator_09__stellaris__buildings__layout__calendar_event_count": 5.0,
    "stellarator_09__stellaris__buildings__layout__calendar_first_event_year": 4.5239260339489915,
    "stellarator_09__stellaris__buildings__layout__calendar_last_event_year": 24.95296350307829,
    "stellarator_09__stellaris__buildings__layout__capacity_margin_units": 0.0,
    "stellarator_09__stellaris__buildings__layout__capacity_mode": 1.0,
    "stellarator_09__stellaris__buildings__layout__clean_positions_allocated": 36.0,
    "stellarator_09__stellaris__buildings__layout__contamination_procedure_qualified": 0.0,
    "stellarator_09__stellaris__buildings__layout__control_air_volume": 2340.0000000000005,
    "stellarator_09__stellaris__buildings__layout__control_clear_area": 585.0000000000001,
    "stellarator_09__stellaris__buildings__layout__control_clear_height": 4.0,
    "stellarator_09__stellaris__buildings__layout__control_clear_length": 34.20526275297414,
    "stellarator_09__stellaris__buildings__layout__control_clear_width": 17.10263137648707,
    "stellarator_09__stellaris__buildings__layout__control_gross_area": 616.1447364776769,
    "stellarator_09__stellaris__buildings__layout__control_sub_concrete": 184.84342094330307,
    "stellarator_09__stellaris__buildings__layout__control_sub_formwork": 31.50473647767673,
    "stellarator_09__stellaris__buildings__layout__control_sub_rebar": 18484.342094330306,
    "stellarator_09__stellaris__buildings__layout__control_super_concrete": 247.8078932062422,
    "stellarator_09__stellaris__buildings__layout__control_super_formwork": 1436.529463723164,